{"policies":{"challenge":{"incidental_findings_allowed":false,"max_closure_revisions":1,"semantic_result_model_shopping_allowed":false},"decision_request":{"scope":"full-current-subject-plus-current-protocol-plus-finding"},"external_outcomes":["GATE-A-READY","DECISION-REQUIRED","OPERATOR-ACTION-REQUIRED"],"model_identity":{"effective_duplicate_fields":["provider","model_version"],"identity_fields":["provider","model","model_version"]},"normalization":{"mode":"one-to-one","semantic_deduplication_allowed":false,"semantic_merge_allowed":false},"retry":{"all_completed_attempts_must_be_sealed":true,"schema_invalid_completion_retry_allowed":true,"semantic_result_retry_allowed":false,"technical_retry_allowed":true}},"prompts":{"adjudication":{"path":"formal/reviews/prompts/gate-a-adjudication-v1.md","sha256":"76a342dd88f2566a9fa40ee3b9f5ccbd6d5b399de822227b3ccd451774dc2f50"},"challenge":{"path":"formal/reviews/prompts/gate-a-challenge-v1.md","sha256":"b5fef8fd42eef80175556322c8067dc5ea9c1eb66869061e22ef194a434aeb65"},"initial-reviewer":{"path":"formal/reviews/prompts/gate-a-initial-review-v1.md","sha256":"516c63b4df16c72fb7ac1718fa4af5a9ab402e0ecf9c460d44a65858b7862748"},"repair":{"path":"formal/reviews/prompts/gate-a-repair-v1.md","sha256":"3c7e1e97667c5f0e3d2e578d6c256a22cf5227b66865f858421cc7d23dad5a6c"}},"protocol_bundle_schema_version":1,"protocol_id":"gate-a-campaign-protocol-v1","review_class":"assurance-decomposition","reviewer_profiles":[],"schemas":{"challenge-output":{"path":"formal/reviews/schemas/challenge-output-v1.schema.json","sha256":"418245a1619b51090fc52e431996f05303ce6f38736423212879b6cb768419f2"},"execution-receipt":{"path":"formal/reviews/schemas/execution-receipt-v1.schema.json","sha256":"f23511730695a61d4a79102874228196c26af9c6c8ce3b4af6251c1429dd8d2b"},"raw-review-output":{"path":"formal/reviews/schemas/raw-review-output-v1.schema.json","sha256":"ab9c8f7c8d0e0314a925a7feb589975c98314c0e47e70c7794c1e1443aca8b6c"}}}
